{
  "definitions": {},
  "$schema": "http://json-schema.org/draft-07/schema#",
  "$id": "http://example.com/root.json",
  "type": "object",
  "title": "The Root Schema",
  "required": [
    "felles"
  ],
  "properties": {
    "felles": {
      "type": "object"
    },
    "ytelse": {
      "type": "string"
    },
    "avdeling": {
      "type": "string"
    },
    "flere√Örsaker": {
      "type": "boolean"
    },
    "aarsakKlagetForSent": {
      "type": "boolean"
    },
    "aarsakManglerUnderskrift": {
      "type": "boolean"
    },
    "aarsakIkkeEtVedtak": {
      "type": "boolean"
    },
    "aarsakVedtakGjelderIkkePart": {
      "type": "boolean"
    },
    "aarsakManglerKlagegrunn": {
      "type": "boolean"
    },
    "hjemler": {
      "type": "string"
    }
  }
}
